{
  "source": "vendor/opengrid-shelf/opengrid-shelf.scad",
  "groups": [
    "Shelf Parameters",
    "Snap Parameters"
  ],
  "parameters": [
    {
      "name": "shelf_width",
      "group": "Shelf Parameters",
      "type": "number",
      "default": 84,
      "description": "Dimensions are in millimeters. Multiple shelves can fit side-by-side on the grid if your Shelf Width is an odd multiple of 28mm, such as 112mm or 196mm.",
      "widget": "number"
    },
    {
      "name": "shelf_depth",
      "group": "Shelf Parameters",
      "type": "number",
      "default": 170,
      "description": null,
      "widget": "number"
    },
    {
      "name": "snap_type",
      "group": "Snap Parameters",
      "type": "string",
      "default": "Directional",
      "description": "openGrid snap type for connecting to base plates.",
      "widget": "dropdown",
      "options": [
        {
          "value": "Lite",
          "label": "Lite"
        },
        {
          "value": "Full",
          "label": "Full"
        },
        {
          "value": "Directional",
          "label": "Directional"
        }
      ]
    },
    {
      "name": "snap_fitment",
      "group": "Snap Parameters",
      "type": "number",
      "default": 0.66,
      "description": "The fitment affects the tightness of the snap when mounted (ease of removing the peg) Use a value between 0.0 and 1.0, with 0.5 meaning a standard fit. A value between 0.66-0.75 would be a tight fit, and a value of 1.0 would be very difficult to insert and remove.",
      "widget": "number"
    }
  ],
  "computed_skipped": [],
  "model": "opengrid-shelf/shelf"
}
