{
  "source": "vendor/gridfinity-basket/gridfinityBasket.scad",
  "groups": [
    "General Settings",
    "WallPattern Settings",
    "Handle Settings",
    "Stacking Settings"
  ],
  "parameters": [
    {
      "name": "UseMulticolor",
      "group": "General Settings",
      "type": "boolean",
      "default": false,
      "description": "Add color to the model",
      "widget": "checkbox"
    },
    {
      "name": "UseGridfinityBase",
      "group": "General Settings",
      "type": "boolean",
      "default": true,
      "description": "Include a gridfinity base inside the basket?",
      "widget": "checkbox"
    },
    {
      "name": "GridSize",
      "group": "General Settings",
      "type": "number[]",
      "default": [
        3,
        3,
        6
      ],
      "description": "Gridsize",
      "min": 1,
      "step": 1,
      "widget": "number"
    },
    {
      "name": "Padding",
      "group": "General Settings",
      "type": "number",
      "default": 1,
      "description": "Padding between edge of gridfinity base and the basket walls",
      "min": 0,
      "step": 0.1,
      "max": 10,
      "widget": "slider"
    },
    {
      "name": "WallThickness",
      "group": "General Settings",
      "type": "number",
      "default": 1.2,
      "description": "Wall Thickness of the Basket",
      "min": 0.4,
      "step": 0.1,
      "max": 2,
      "widget": "slider"
    },
    {
      "name": "AdditionalFloorHeight",
      "group": "General Settings",
      "type": "number",
      "default": 1,
      "description": "Additional floor height added to the bottom of the basket.",
      "min": 0,
      "step": 0.04,
      "max": 3,
      "widget": "slider"
    },
    {
      "name": "SolidFloor",
      "group": "General Settings",
      "type": "boolean",
      "default": true,
      "description": "Solid floor? Requires AdditionalFloorHeight > 0 to work",
      "widget": "checkbox"
    },
    {
      "name": "MagnetDiameter",
      "group": "General Settings",
      "type": "number",
      "default": 6.1,
      "description": "Diamenter of the magnets. If set to zero, no magnet holes will be created. Increase this value to add some tolerance for magnet insertion.",
      "min": 0,
      "step": 0.05,
      "max": 8,
      "widget": "slider"
    },
    {
      "name": "MagnetHeight",
      "group": "General Settings",
      "type": "number",
      "default": 2.1,
      "description": "Height of the magnets. If set to zero, no magnet holes will be created. Increase this value to add some tolerance for magnet insertion.",
      "min": 0,
      "step": 0.05,
      "max": 4,
      "widget": "slider"
    },
    {
      "name": "AddMagnetChamfer",
      "group": "General Settings",
      "type": "boolean",
      "default": false,
      "description": "Add additional chamfers around magnet holes to help with insertion",
      "widget": "checkbox"
    },
    {
      "name": "WallPattern",
      "group": "WallPattern Settings",
      "type": "number",
      "default": 1,
      "description": "Wall Pattern",
      "widget": "dropdown",
      "options": [
        {
          "value": 0,
          "label": "None"
        },
        {
          "value": 1,
          "label": "HexGrid"
        },
        {
          "value": 2,
          "label": "Grid"
        }
      ]
    },
    {
      "name": "PatternSize",
      "group": "WallPattern Settings",
      "type": "number",
      "default": 8,
      "description": "Pattern feature size",
      "min": 4,
      "step": 0.5,
      "max": 15,
      "widget": "slider"
    },
    {
      "name": "PatternTopDist",
      "group": "WallPattern Settings",
      "type": "number",
      "default": 3,
      "description": "Minimum distance from the top of the pattern to the start of the stacking lip",
      "min": 0,
      "step": 0.1,
      "max": 10,
      "widget": "slider"
    },
    {
      "name": "PatternBotDist",
      "group": "WallPattern Settings",
      "type": "number",
      "default": 1.5,
      "description": "Minimum distance from the bottom of the pattern to the baseplate",
      "min": 0,
      "step": 0.1,
      "max": 10,
      "widget": "slider"
    },
    {
      "name": "PatternSideDist",
      "group": "WallPattern Settings",
      "type": "number",
      "default": 2,
      "description": "Minimum distance from the pattern sides to the start of the basket outer corner",
      "min": 0,
      "step": 0.1,
      "max": 10,
      "widget": "slider"
    },
    {
      "name": "PatternMinDist",
      "group": "WallPattern Settings",
      "type": "number",
      "default": 2,
      "description": "Minimum distance between patterns",
      "min": 0.5,
      "step": 0.1,
      "max": 5,
      "widget": "slider"
    },
    {
      "name": "GridPatternRadius",
      "group": "WallPattern Settings",
      "type": "number",
      "default": 4,
      "description": "Outer radius of grid pattern (has no effect on other patterns)",
      "min": 0,
      "step": 0.5,
      "max": 10,
      "widget": "slider"
    },
    {
      "name": "AddHandle",
      "group": "Handle Settings",
      "type": "boolean",
      "default": true,
      "description": "Add a handle to the sides of the basket",
      "widget": "checkbox"
    },
    {
      "name": "HandleWidth",
      "group": "Handle Settings",
      "type": "number",
      "default": 35,
      "description": "Width of the handle",
      "min": 20,
      "step": 1,
      "max": 100,
      "widget": "slider"
    },
    {
      "name": "HandleHeight",
      "group": "Handle Settings",
      "type": "number",
      "default": 11,
      "description": "Height of the handle",
      "min": 11,
      "step": 1,
      "max": 30,
      "widget": "slider"
    },
    {
      "name": "HandleCornerRadius",
      "group": "Handle Settings",
      "type": "number",
      "default": 4,
      "description": "Radii of the corners on the inside of the handles",
      "min": 0,
      "step": 0.5,
      "max": 5,
      "widget": "slider"
    },
    {
      "name": "HandleBorder",
      "group": "Handle Settings",
      "type": "number",
      "default": 3,
      "description": "Minimum border around the handle. The border may be larger to accommodate the wall pattern.",
      "min": 2,
      "step": 0.5,
      "max": 5,
      "widget": "slider"
    },
    {
      "name": "Standoff",
      "group": "Stacking Settings",
      "type": "number",
      "default": 1,
      "description": "How far down a basket reaches into a basket under it. Increasing this value decreses wiggle when stacking baskets.",
      "min": 1,
      "step": 0.1,
      "max": 2,
      "widget": "slider"
    },
    {
      "name": "TopPadding",
      "group": "Stacking Settings",
      "type": "number",
      "default": 2,
      "description": "extra room between top of any bin and bottom of another basket stacked on top",
      "min": 0.5,
      "step": 0.1,
      "max": 5,
      "widget": "slider"
    },
    {
      "name": "XYTolerance",
      "group": "Stacking Settings",
      "type": "number",
      "default": 0.5,
      "description": "XY tolerance (leave as-is in most cases)",
      "min": 0.2,
      "step": 0.05,
      "max": 1,
      "widget": "slider"
    },
    {
      "name": "ZTolerance",
      "group": "Stacking Settings",
      "type": "number",
      "default": 0.25,
      "description": "Z tolerance (lave as-is in most cases)",
      "widget": "number"
    }
  ],
  "computed_skipped": [],
  "model": "gridfinity-basket/basket"
}
