{
  "source": "vendor/gridfinity-rebuilt/gridfinity-rebuilt-baseplate.scad",
  "groups": [
    "General Settings",
    "Screw Together Settings - Defaults work for M3 and 4-40",
    "Fit to Drawer",
    "Styles",
    "Magnet Hole"
  ],
  "parameters": [
    {
      "name": "gridx",
      "group": "General Settings",
      "type": "number",
      "default": 1,
      "description": "number of bases along x-axis",
      "widget": "number"
    },
    {
      "name": "gridy",
      "group": "General Settings",
      "type": "number",
      "default": 1,
      "description": "number of bases along y-axis",
      "widget": "number"
    },
    {
      "name": "d_screw",
      "group": "Screw Together Settings - Defaults work for M3 and 4-40",
      "type": "number",
      "default": 3.35,
      "description": "screw diameter",
      "widget": "number"
    },
    {
      "name": "d_screw_head",
      "group": "Screw Together Settings - Defaults work for M3 and 4-40",
      "type": "number",
      "default": 5,
      "description": "screw head diameter",
      "widget": "number"
    },
    {
      "name": "screw_spacing",
      "group": "Screw Together Settings - Defaults work for M3 and 4-40",
      "type": "number",
      "default": 0.5,
      "description": "screw spacing distance",
      "widget": "number"
    },
    {
      "name": "n_screws",
      "group": "Screw Together Settings - Defaults work for M3 and 4-40",
      "type": "number",
      "default": 1,
      "description": "number of screws per grid block",
      "min": 1,
      "max": 3,
      "widget": "slider"
    },
    {
      "name": "distancex",
      "group": "Fit to Drawer",
      "type": "number",
      "default": 0,
      "description": "minimum length of baseplate along x (leave zero to ignore, will automatically fill area if gridx is zero)",
      "widget": "number"
    },
    {
      "name": "distancey",
      "group": "Fit to Drawer",
      "type": "number",
      "default": 0,
      "description": "minimum length of baseplate along y (leave zero to ignore, will automatically fill area if gridy is zero)",
      "widget": "number"
    },
    {
      "name": "fitx",
      "group": "Fit to Drawer",
      "type": "number",
      "default": 0,
      "description": "where to align extra space along x",
      "min": -1,
      "step": 0.1,
      "max": 1,
      "widget": "slider"
    },
    {
      "name": "fity",
      "group": "Fit to Drawer",
      "type": "number",
      "default": 0,
      "description": "where to align extra space along y",
      "min": -1,
      "step": 0.1,
      "max": 1,
      "widget": "slider"
    },
    {
      "name": "style_plate",
      "group": "Styles",
      "type": "number",
      "default": 3,
      "description": "baseplate styles",
      "widget": "dropdown",
      "options": [
        {
          "value": 0,
          "label": "thin"
        },
        {
          "value": 1,
          "label": "weighted"
        },
        {
          "value": 2,
          "label": "skeletonized"
        },
        {
          "value": 3,
          "label": "screw together"
        },
        {
          "value": 4,
          "label": "screw together minimal"
        }
      ]
    },
    {
      "name": "style_hole",
      "group": "Styles",
      "type": "number",
      "default": 0,
      "description": "hole styles",
      "widget": "dropdown",
      "options": [
        {
          "value": 0,
          "label": "none"
        },
        {
          "value": 1,
          "label": "countersink"
        },
        {
          "value": 2,
          "label": "counterbore"
        }
      ]
    },
    {
      "name": "enable_magnet",
      "group": "Magnet Hole",
      "type": "boolean",
      "default": true,
      "description": "Baseplate will have holes for 6mm Diameter x 2mm high magnets.",
      "widget": "checkbox"
    },
    {
      "name": "crush_ribs",
      "group": "Magnet Hole",
      "type": "boolean",
      "default": true,
      "description": "Magnet holes will have crush ribs to hold the magnet.",
      "widget": "checkbox"
    },
    {
      "name": "chamfer_holes",
      "group": "Magnet Hole",
      "type": "boolean",
      "default": true,
      "description": "Magnet holes will have a chamfer to ease insertion.",
      "widget": "checkbox"
    }
  ],
  "computed_skipped": [
    {
      "name": "hole_options",
      "group": "Magnet Hole",
      "expression": "bundle_hole_options(refined_hole=false, magnet_hole=enable_magnet, screw_hole=false, crush_ribs=crush_ribs, chamfer=chamfer_holes, supportless=false)"
    }
  ],
  "model": "gridfinity-rebuilt/baseplate"
}
